{
  "case_count": 7,
  "holdout_opened": false,
  "records": [
    {
      "case_id": "p4-acl_negative-0003",
      "chunk_id": "c3b100a5-d5ed-5f63-adbf-0a2d92e7aee2",
      "document_id": "a5418f3e-5bb3-4089-b603-8bb04a1e423c",
      "labeled_actor_id": "p4-actor-member-b",
      "query_class": "acl_negative",
      "restricted_actor": true,
      "split": "development",
      "synthetic_chunk_id": "p4-chk-0203",
      "synthetic_source_id": "p4-src-0203",
      "synthetic_table_id": null,
      "synthetic_version_id": "p4-ver-0203",
      "table_id": null,
      "version_id": "96286c5e-c2a4-4e37-9686-30515af04554",
      "visibility": "restricted",
      "visible_to_actor": false
    },
    {
      "case_id": "p4-alias-0003",
      "chunk_id": "8c72db43-c3e7-548f-965d-f612d8a52b99",
      "document_id": "1b0d09c0-e050-474a-a77f-9158792891f5",
      "labeled_actor_id": "p4-actor-member-a",
      "query_class": "alias",
      "restricted_actor": false,
      "split": "development",
      "synthetic_chunk_id": "p4-chk-0203",
      "synthetic_source_id": "p4-src-0203",
      "synthetic_table_id": null,
      "synthetic_version_id": "p4-ver-0203",
      "table_id": null,
      "version_id": "f24d149d-97f8-4ef3-acd3-cb8f91fd6f06",
      "visibility": "company_visible",
      "visible_to_actor": true
    },
    {
      "case_id": "p4-arabic_mixed-0003",
      "chunk_id": "edd8beab-3945-5088-8fee-7a7ea97a0aa6",
      "document_id": "769f3b6c-668b-40d2-ac3f-5377a64f831a",
      "labeled_actor_id": "p4-actor-member-a",
      "query_class": "arabic_mixed",
      "restricted_actor": false,
      "split": "development",
      "synthetic_chunk_id": "p4-chk-0203",
      "synthetic_source_id": "p4-src-0203",
      "synthetic_table_id": null,
      "synthetic_version_id": "p4-ver-0203",
      "table_id": null,
      "version_id": "3174ccf2-a263-4730-a384-2e98dd0103a5",
      "visibility": "company_visible",
      "visible_to_actor": true
    },
    {
      "case_id": "p4-exact_code-0003",
      "chunk_id": "91d1dded-8145-5013-a1ec-2fd1f390e5b5",
      "document_id": "3367635d-7b03-4be7-945c-dd207c848e02",
      "labeled_actor_id": "p4-actor-member-a",
      "query_class": "exact_code",
      "restricted_actor": false,
      "split": "development",
      "synthetic_chunk_id": "p4-chk-0253",
      "synthetic_source_id": "p4-src-0253",
      "synthetic_table_id": null,
      "synthetic_version_id": "p4-ver-0253",
      "table_id": null,
      "version_id": "3a41a379-c8ef-4f58-ad22-dd747b4d42af",
      "visibility": "company_visible",
      "visible_to_actor": true
    },
    {
      "case_id": "p4-latest_as_of-0003",
      "chunk_id": "b6e3b828-c444-5afb-9111-1b0f6f90fb0a",
      "document_id": "0d3d1169-f237-47bf-a312-25b7acbc4536",
      "labeled_actor_id": "p4-actor-member-a",
      "query_class": "latest_as_of",
      "restricted_actor": false,
      "split": "development",
      "synthetic_chunk_id": "p4-chk-0153",
      "synthetic_source_id": "p4-src-0153",
      "synthetic_table_id": null,
      "synthetic_version_id": "p4-ver-0153",
      "table_id": null,
      "version_id": "0bfd5c6b-e807-442f-a67a-2673b700afab",
      "visibility": "company_visible",
      "visible_to_actor": true
    },
    {
      "case_id": "p4-media_limitation-0002",
      "chunk_id": "25234fd7-c7fe-5b12-91e6-6752c96ae68b",
      "document_id": "31a7545f-f608-4a9c-a207-327d70af00bd",
      "labeled_actor_id": "p4-actor-member-a",
      "query_class": "media_limitation",
      "restricted_actor": false,
      "split": "qualification",
      "synthetic_chunk_id": "p4-chk-0052",
      "synthetic_source_id": "p4-src-0052",
      "synthetic_table_id": null,
      "synthetic_version_id": "p4-ver-0052",
      "table_id": null,
      "version_id": "c977b330-df35-47f2-9551-8713e26ff6af",
      "visibility": "company_visible",
      "visible_to_actor": true
    },
    {
      "case_id": "p4-tabular_aggregation-0003",
      "chunk_id": null,
      "document_id": "f567ecde-f53c-4582-aafd-f935e8495199",
      "labeled_actor_id": "p4-actor-member-a",
      "query_class": "tabular_aggregation",
      "restricted_actor": false,
      "split": "development",
      "synthetic_chunk_id": null,
      "synthetic_source_id": "p4-src-0203",
      "synthetic_table_id": "p4-tbl-0203",
      "synthetic_version_id": "p4-ver-0203",
      "table_id": null,
      "version_id": "6cc1ac54-b49e-42f3-815c-b97a5d3675c7",
      "visibility": "company_visible",
      "visible_to_actor": true
    }
  ],
  "runtime_owner": "phase_4",
  "schema_version": "phase4-gold-id-map-v1",
  "sidecar_sha256": "441c9a4494bbde29f7265c46d8559783366e0138030a3c2564f54b85217b4dad",
  "splits": [
    "development",
    "qualification"
  ]
}
